{
  "schema_version": 1,
  "artifact_type": "GateDecision",
  "spec_id": "SPEC-AI-001",
  "run_id": "RUN-gh-1000000001-1",
  "created_at": "2026-10-01T13:05:00Z",
  "producer": { "kind": "aggregator", "name": "hlg-gate-aggregator" },
  "source_commit": "bbbbbbbbbbbbbbbbbbbbbbbbbbbbbbbbbbbbbbbb",
  "base_commit": "aaaaaaaaaaaaaaaaaaaaaaaaaaaaaaaaaaaaaaaa",
  "policy_version": 1,
  "decision": "WAITING_HUMAN",
  "reasons": [
    { "code": "APPROVAL_PENDING", "detail": "Structural example only; not an authoritative decision." }
  ],
  "inputs": [
    {
      "artifact_type": "EvalReport",
      "run_id": "RUN-gh-1000000001-1",
      "sha256": "cccccccccccccccccccccccccccccccccccccccccccccccccccccccccccccccc"
    }
  ],
  "required_checks": [
    { "check_id": "build", "result": "PASS" },
    { "check_id": "contract_tests", "result": "PASS" }
  ],
  "findings": [
    { "report_type": "SecurityReviewReport", "finding_id": "F-001", "gate_impact": "non_blocking" }
  ],
  "approvals": [
    {
      "approval": {
        "approval_type": "spec",
        "source": "github_pr_comment",
        "pr_number": 1,
        "source_id": "1000000001",
        "object_sha": "dddddddddddddddddddddddddddddddddddddddd"
      },
      "status": "pending"
    }
  ]
}
